{
  "request_id": "550e8400-e29b-41d4-a716-446655440001",
  "format": "journal-club",
  "topic": {
    "title": "TTM2 Trial Review: Targeted Temperature Management After Cardiac Arrest",
    "clinical_question": "In adult patients with comatose out-of-hospital cardiac arrest of presumed cardiac cause, does targeted temperature management at 33°C compared with 36°C (normothermia with early treatment of fever) reduce mortality or improve neurological outcomes at 6 months?",
    "trial_reference": {
      "pmid": "34161739",
      "doi": "10.1056/NEJMoa2100591",
      "title": "Hypothermia versus Normothermia after Out-of-Hospital Cardiac Arrest",
      "acronym": "TTM2"
    },
    "scope_notes": "Focus on the evolution of temperature management evidence from TTM to TTM2. Include discussion of why results differed from earlier studies. Address implications for Australian practice.",
    "keywords": [
      "cardiac arrest",
      "targeted temperature management",
      "hypothermia",
      "ROSC",
      "neurological outcome",
      "post-resuscitation care"
    ],
    "related_conditions": [
      "out-of-hospital cardiac arrest",
      "post-cardiac arrest syndrome",
      "hypoxic brain injury"
    ]
  },
  "requestor": {
    "name": "Dr Jane Smith",
    "email": "jane.smith@health.qld.gov.au",
    "institution": "Royal Brisbane and Women's Hospital",
    "role": "Emergency Medicine Registrar"
  },
  "target_audience": "mixed",
  "urgency": "routine",
  "regional_context": "australia",
  "suggested_reviewers": [
    {
      "name": "Dr Michael Brown",
      "email": "michael.brown@health.qld.gov.au",
      "credentials": "MBBS FACEM FCICM",
      "speciality": "Intensive Care Medicine"
    }
  ],
  "additional_resources": [
    {
      "type": "pmid",
      "reference": "24237006",
      "notes": "Original TTM trial for comparison"
    },
    {
      "type": "guideline",
      "reference": "ARC/ANZCOR Guideline 11.8",
      "notes": "Current Australian guidance on post-resuscitation temperature management"
    }
  ],
  "created_at": "2025-01-21T10:00:00Z",
  "metadata": {
    "source": "manual",
    "version": "1.0.0"
  }
}
